id,date,update,title,summary,pdf
IN12537,2025-05-16T04:00:00Z,2025-06-21T07:06:19Z,Case Studies of How Generative Artificial Intelligence is Changing Work,"Generative Artificial Intelligence (GenAI) is a new technology that can generate new code, text, images, and other content based on machine learning systems and can be trained using large quantities of previous content.  During the 118th Congress, there were multiple congressional hearings on how GenAI technology may affect work and workers. GenAI became widely available only recently, and there are few case studies documenting how it is already changing the experience of work. This Insight summarizes two such case studies identified by CRS. In each of these studies, a new GenAI tool was intentionally rolled out to some workers before others so that researchers could compare workers who had access to the tool with similar workers who did not yet have access. In these studies, GenAI tools boosted job performance more for less experienced software developers and customer service agents. These findings highlight how much is still unknown about which workers will be most affected by GenAI technology.AI-Based Coding Assistance for Software DevelopersIn The Effects of Generative AI on High Skilled Work: Evidence from Three Field Experiments with Software Developers, Kevin Zheyuan Cui et al. describe the rollout of GitHub CoPilot to thousands of software developers at Microsoft in 2022, and to Accenture and an anonymous large electronics manufacturing company in 2023. GitHub CoPilot is a GenAI tool that makes suggestions of code and code documentation. Not every software developer given early access to the tool used it—between 60% and 70% of people who had early access tried it during the study period. Overall, those who had early access to GitHub CoPilot completed more coding tasks and completed them more successfully than their peers without early access. Among Microsoft software developers, the likelihood of trying the tool, the likelihood of continuing to use the tool after trying it, and the gains from tool access on productivity were all larger for more recent hires. AI-Based Conversation Assistance for Customer Support AgentsIn Generative AI at Work, Danielle Li, Erik Brynjolfsson, and Lindsey Raymond describe the rollout of an AI chat assistant (built on GPT-3 technology) to thousands of customer support agents in a large software company during 2020-2021. Customer support agents at this company—most based in the Philippines—helped U.S. clients deal with problems during calls lasting an average of 40 minutes. Customer support agents needed both technical knowledge and skill dealing with frustrated customers to do the job well. Their performance was measured by how quickly they successfully resolved customers’ issues, as well as by customer satisfaction surveys.The GenAI tool used at this company was trained on a dataset of previous customer-agent conversations from the best-performing agents. This tool listened to agents’ discussions with customers and offered real-time suggestions for what agents should say, which agents could either use or ignore. The agents who had access to the tool and were newer or less fluent in English used it to learn how do their job more like the best-performing customer service agents whose conversations were used to train the tool. The GenAI tool was most helpful for agents helping customers with “moderately rare” problems, in which new agents might have little experience but there was enough data to train the tool. Customer service agents with access to the GenAI tool who had two months of experience handled calls as well as agents without the tool who had six months of experience. Workers who used the tool to improve their performance continued to do better when the tool was unavailable. Agents based in the Philippines were able to interact with customers more like agents based in the United States. Using the GenAI tool appeared to make the customer service job less stressful for agents who used it: agents who had access to the tool saw a reduction in negative customer speech (such as yelling or swearing at agents) and in customer requests to speak with a manager. Agents who used the tool were also less likely to leave the company. A previous version of this Insight also summarized the paper Artificial Intelligence, Scientific Discovery, and Product Innovation. On May 16, 2025, the MIT Department of Economics released a statement saying, “the findings reported in this paper should not be relied on in academic or public discussions of these topics.”",https://www.congress.gov/crs_external_products/IN/PDF/IN12537/IN12537.2.pdf
R47843,2024-04-03T04:00:00Z,2025-06-21T03:25:57Z,Highlights of the 2023 Executive Order on Artificial Intelligence for Congress,"On October 30, 2023, the Biden Administration released Executive Order (E.O.) 14110 on Safe, Secure, and Trustworthy Development and Use of Artificial Intelligence. It establishes a government-wide effort to guide responsible artificial intelligence (AI) development and deployment through federal agency leadership, regulation of industry, and engagement with international partners. The E.O. directs over 50 federal entities to engage in more than 100 specific actions to implement the guidance set forth across eight overarching policy areas.Safety and security. The E.O. promotes the development and implementation of repeatable processes and mechanisms to understand and mitigate risks related to AI adoption, including with respect to biosecurity, cybersecurity, national security, and critical infrastructure. Innovation and competition. The E.O. compels actions to attract AI talent to the United States, understand novel intellectual property (IP) questions, protect inventors and creators, and promote AI innovation, including at startups and small businesses. Worker support. The E.O. states that AI adoption may be disruptive to the workforce and directs agencies to research and develop potential mitigations against such disruptions. Consideration of AI bias and civil rights. The E.O. states that AI models may perpetuate biases and their implementation may lead to civil rights violations. The E.O. includes a section on equity and civil rights considerations for use of AI in the criminal justice system and the administration of federal government programs and benefits. Consumer protection. The E.O. instructs agencies to enforce existing, technology-agnostic authorities in an effort to minimize harms to consumers, and to identify needed authorities related to AI. Privacy. The E.O. calls for the evaluation and mitigation of privacy risks—potentially exacerbated by AI—associated with the collection, use, and retention of user data. Federal use of AI. The E.O. requires the Office of Management and Budget (OMB) to establish an interagency council to coordinate AI use by federal agencies and develop guidance on AI governance and risk management activities for agencies. It acknowledges the ubiquity of generative AI (GenAI) tools, and directs agencies to move toward adoption with safeguards in place. The E.O. also calls for additional agency hiring and training activities to increase the AI workforce capacity across the federal government. International leadership. The E.O. declares that the United States should be a global leader in AI development and adoption by engaging with international allies and partners, leading efforts to develop common AI regulatory and accountability principles, and advancing responsible global technical standards for AI.",none found
IF12899,2025-02-05T05:00:00Z,2025-06-21T05:08:24Z,Data Centers and Cloud Computing: Information Technology Infrastructure for Artificial Intelligence,"The advancement of artificial intelligence (AI), a “critical and emerging technology,” presents policy considerations for U.S. leadership, with implications for economic competitiveness and national security. AI systems, including their development, model training, deployment, operation, applications, and services, rely on an information technology (IT) infrastructure with components of hardware, software, networks, data, and facilities. Data centers are the primary means to house much of this IT backbone. Internet-based remote computing services (i.e., cloud computing) enable AI developers and users to access computing resources hosted in geographically distributed data centers. Not only may AI innovation and competition hinge on the availability of and access to advanced, secure, and sustainable computing resources, but such IT infrastructure may also be deemed “a strategic national asset.” Related issues have attracted congressional attention in recent years (e.g., a Senate committee hearing on advanced computing research and a House committee hearing on “powering AI”).The U.S. government has increasingly focused on policy directions to support building a robust, domestic AI infrastructure. For example, President Biden issued Executive Order (E.O.) 14141, “Advancing United States Leadership in Artificial Intelligence Infrastructure,” on January 14, 2025, providing a federal plan to build AI infrastructure in the United States. On January 21, 2025, President Trump announced a private joint venture with potential investment of up to $500 billion to fund AI infrastructure, including plans to build up to 20 data centers in the country. The National Telecommunications and Information Administration (NTIA), a Department of Commerce agency serving as the President’s principal advisor on telecommunication and information policies, issued a request for comments (RFC) to inform policymaking for “sustainable, resilient and secure” growth of data centers to power critical and emerging technologies, including AI. The RFC received 58 comments, ranging from the importance of allocating an estimated $175 billion of potential funds to U.S.-backed global AI infrastructure projects to challenges faced by domestic data centers, such as regulatory obstacles for siting new facilities and access to energy, supply chains, and operational workforce.This In Focus introduces the use of data center and cloud computing infrastructure for AI development and AI-enabled services and selected policy issues for congressional consideration. For more on AI technologies and policies, see CRS Report R47644, Artificial Intelligence: Overview, Recent Advances, and Considerations for the 118th Congress; for more on energy issues related to selected data centers, see CRS Report R45863, Bitcoin, Blockchain, and the Energy Sector.Overview of Data CentersIn its simplest form, a data center is a facility that houses and powers a large computer system. Data centers have evolved to house multiple enterprise-level, interconnected computer servers (e.g., a cluster of servers called a server farm). Personal computers and smart devices connect users to these servers to access online services (e.g., websites, emails, and file sharing). Many data centers have expanded to support cloud computing services, allowing users to remotely access computing resources such as data processing chips, software, data storage, networks, and applications and services hosted by these centers.The term data center has been defined in federal laws in the context of energy efficiency and federal use of data centers. For instance, the Energy Independence and Security Act of 2007 (P.L. 110-140, §453(a)(1)) defines a data center as a facility that “contains electronic equipment used to process, store, and transmit digital information.” In its guidance (M-25-03) for federal agencies to implement the Federal Data Center Enhancement Act of 2023 (P.L. 118-31, §5302), the Office of Management and Budget specified that a data center (1) is composed of permanent structures and operates in a fixed location; (2) houses IT equipment, including servers and other high-performance computing devices, or data storage devices; and (3) hosts information and information systems accessed by other systems or by users on other devices.Data Centers for AIThe ever-increasing demand for data storage and processing capacities, especially for intensive computational tasks such as AI training, has led to construction and operation of hyperscale data centers. According to industry analysts, to be considered a hyperscale data center, a facility must contain at least 5,000 servers and occupy at least 10,000 square feet of physical space, with a power demand exceeding 100 megawatts (MW). If a data center had a continuous power demand of 100 MW for 24 hours, it would consume 2,400 MW-hours (MWh) of energy.These large facilities provide powerful computing resources (such as memories, central processing units [CPUs], and graphics processing units [GPUs]) to handle vast amounts of data and large-scale workloads. (CPU and GPU are two major types of computing chips found in most personal computers and servers.) General-purpose workloads typically require only a CPU, while a GPU is generally considered better than a CPU to handle AI computational tasks. According to the chip manufacturer Nvidia, an AI-ready data-center server can support one to eight high-performance GPUs, each of which consumes hundreds of watts of electricity. Cutting-edge chip technologies also support high-speed (at the gigabit-per-second level) GPU-to-GPU data communication among hundreds of GPUs across multiple servers, enabling the creation of a massive AI server farm in a data center.In E.O. 14141, the term AI data center means a data center used primarily to develop or operate AI, and the term frontier AI data center means an AI data center capable of being used to develop an AI model that matches or surpasses the state-of-the-art AI model with regard to its performance or computational resources used in its development. These frontier AI models and related services typically require more power than traditional IT operations supported by data centers (e.g., data storage, retrieval, and transmission). For example, ChatGPT was estimated to use 2.9 watt-hours to respond to a user query, while a traditional Google search query uses about 0.3 watt-hours.Multiple industry reports indicate that data processing demands of AI and related cloud computing services have spurred new construction and upgrades of data centers. The computing resources hosted by these centers would in turn lead to increased power demand. For example, one report estimated that the computing capacity (measured by the power demand) of data centers under construction in North America in the first half of 2024 reached a record-high 3,872 MW, up by 69% from a year earlier. Nearly 80% of this capacity has been pre-leased, with AI and cloud service providers contributing to significant portions of such demand. A report commissioned by the Department of Energy estimated that data centers accounted for about 4.4% of total U.S. electricity consumption (or about 176 million MWh) in 2023, “equivalent to the average annual consumption of 14 million households.” According to another report, new hyperscale data centers have been built with capacities from 100 to 1,000 MW, “roughly equivalent to the load from 80,000 to 800,000 homes.”Investments in AI InfrastructureMany experts believe that AI development and operation require significant capital investment. According to the annual AI Index Report 2024, costs of training large foundation models alone could “run into millions of dollars and are rising.” Given rental prices charged by major cloud service providers for accessing computing hardware, the report estimated that training costs in 2023 for OpenAI’s GPT-4 and Google’s Gemini Ultra were around $78 million and $191 million, respectively (excluding other costs, such as data acquisition and labor). In a January 24, 2025, Facebook post, Meta’s CEO revealed that the company was building a 2,000-MW data center and planned to spend $60-$65 billion in AI capital expenditures and acquire over 1.3 million GPUs by the end of 2025. Three days earlier at the White House, a group of companies announced a joint venture called Stargate, planning to invest up to $500 billion over the next four years to build AI infrastructure in the United States. Stargate’s first data center, reportedly under construction, would be used by OpenAI and operated by Oracle (one of the largest cloud-based database vendors).The tech industry and financial market have raised questions about large investments in AI infrastructure, due to the emergence of high-performing AI models developed by the less-known Chinese company DeepSeek. The company claimed in a non-peer-reviewed technical report that it has developed a large language model (LLM) called DeepSeek-V3 using efficient and cost-effective approaches. The model required 2.8 million GPU hours (equal to about 57 days) for its full training on a cluster of 2,048 Nvidia H800 GPUs. Assuming the cloud rental price at $2 per GPU hour, DeepSeek reported its total training cost for the model was $5.6 million—a fraction of what is currently spent by leading U.S. AI companies (e.g., $78 million for GPT-4). Nvidia reportedly developed the H800 chip in March 2023 as a modified version of its more powerful H100 GPU to comply with U.S. export control regulations. It is no longer permissible to export the H800 chip since the Department of Commerce’s Bureau of Industry and Security updated its rules on advanced computing chips in October 2023 (see Category 3A090 in Supplement No. 1 to 15 C.F.R. Part 774).According to its report, DeepSeek evaluated its V3 model against several leading LLMs, including those developed by Alibaba, Meta, OpenAI, and Anthropic. In six benchmark tests in language understanding, graduate-level science and mathematics questions, high school-level math competition questions, coding, and memory-chip security, the company claimed that DeepSeek-V3 outperformed the competitors in three and ranked second in the other three. The widely reported relatively low-cost advancement in AI model training has raised questions about the necessity of large AI investments, the efficiency of AI development, and U.S. leadership in the field.Selected Policy Issues for CongressAI infrastructure, including data centers, cloud computing services, and energy resources, is vital for AI development and operation. The criticality of such infrastructure raises policy issues such as data security, infrastructure access and security, energy reliability and efficiency, and costs of building such infrastructure, all of which implicate national security interests. Investment, construction, and operation of AI infrastructure may impact job and workforce development opportunities, and the economies and natural resources of local communities near data centers.Previous Congresses saw bills to assess, understand, and address potential impacts of growth in AI, data centers, and needs for advanced computing resources. For example, the Department of Energy AI Act (S. 4664, 118th Congress) would have required the Secretary of Energy to report to Congress on data centers for advanced computing, their hardware and software needs for AI, and national security risks. The Remote Access Security Act (H.R. 8152, 118th Congress) would have expanded export controls to include remote access (e.g., through a cloud computing service) to a commodity, software, or technology for purposes such as training AI models.",https://www.congress.gov/crs_external_products/IF/PDF/IF12899/IF12899.1.pdf
R47849,2023-11-22T05:00:00Z,2025-06-21T04:37:01Z,"Artificial Intelligence in the Biological Sciences: Uses, Safety, Security, and Oversight","Artificial intelligence (AI) is a term generally thought of as computerized systems that work and react in ways commonly thought to require intelligence. AI technologies, methodologies, and applications can be used throughout the biological sciences and biology research and development (R&D), including in engineering biology (e.g., the application of engineering principles and the use of systematic design tools to reprogram cellular systems for a specific functional output). This has enabled R&D advances across multiple application areas and industries. For example, AI can be used to analyze genomic data (e.g., DNA sequences) to determine the genetic basis of a particular trait and potentially uncover genetic markers linked with those traits. It has also been used in combination with biological design tools to aid in characterizing proteins (e.g., 3-D structure) and for designing new chemical structures that can enable specific medical applications, including for drug discovery. AI can also be used across the scientific R&D process, including the design of laboratory experiments, protocols to run certain laboratory equipment, and other “de-skilling” aspects of scientific research. The convergence of AI and other technologies associated with biology can lower technical and knowledge barriers and increase the number of actors with certain capabilities. These capabilities have potential for beneficial uses while at the same time raising certain biosafety and biosecurity concerns. For example, some have argued that using AI for biological design can be repurposed or misused to potentially produce biological and chemical compounds of concern. Both AI and engineering biology are multidisciplinary fields that build on advances in multiple scientific disciplines and technical developments that each have associated benefits and risks. As they converge, those benefits and risks may compound and create unique uncertainties, challenge governance systems, and, in some instances, raise new biosafety and biosecurity concerns. The U.S. Intelligence Community’s 2023 Annual Threat Assessment stated that the fields of AI and biotechnology are “being developed and are proliferating faster than companies and governments can shape norms, protect privacy, and prevent dangerous outcomes.” AI’s use in biology sits within a broader debate on how best to manage biosafety and biosecurity, including whether that use may lower technical and knowledge barriers and increase the likelihood of malign use. The potential for the use of AI in conjunction with biological design and other types of scientific research and experimentation has prompted recommendations from various groups on how to prevent the misuse of AI applications in biology and science more broadly. These include keeping a human “in the loop,” controlling access to DNA sequences and synthesis capabilities, and governance mechanisms that restrict, or monitor, who can access certain AI applications and biological design tools. Numerous bills introduced in the 118th Congress address the risks, benefits, and strategic competitiveness of AI more generally, while H.R. 4704, S. 2399, and S. 2346 focus more specifically on AI and biological threats. Other policy considerations for Congress could include the following: Whether AI, and its use in biology and other scientific fields, should be regulated broadly across all use cases and areas of development, regulated on a case-by-case basis focused on particular application areas or end-use products, or whether current biosafety and biosecurity oversight frameworks are sufficient. Whether a broad risk management approach examining the R&D system as a whole is most appropriate, including at what stage oversight is warranted (e.g., basic research stage, prototype stage, or prior to release of a final product) and what entity might conduct such oversight (e.g., a federal agency or a system of self-governance incentives). Whether to provide an agency (or agencies) authority to conduct oversight of various aspects of AI, create a new agency with authority over AI, or authorize agencies under current law to enforce certain oversight responsibilities. Authorizing agencies under current law may require additional coordination among federal agencies in order to establish oversight responsibilities. Other types of self-governance incentives could also be examined.Oversight and governance of the use of AI in the biological sciences involves potential benefits and risks associated with the biological design capabilities of AI models, as well as the feasibility of producing AI-generated designs that pose possible biosecurity risks. Regulating AI broadly, or the use of AI in one area of R&D, could impact other areas of R&D in specific or unintended ways. For example, limiting access to AI models, restricting the types of data an AI model may be trained on, or limiting the capabilities an AI model is allowed to execute could each impact a biological design tool’s capability.",https://www.congress.gov/crs_external_products/R/PDF/R47849/R47849.2.pdf
