id,date,update,title,summary,pdf
R48319,2024-12-30T05:00:00Z,2025-06-21T04:54:22Z,Artificial Intelligence (AI) in Health Care,"The use of artificial intelligence (AI) in health care settings has grown over time in part due to recent increases in health care data availability and innovations in big data analytical methods. AI encompasses multiple technologies and is variably defined, with some disagreement at times among stakeholders about which technologies even qualify as AI. Machine learning (ML) techniques, including deep learning and neural networks, underpin many AI tools used in health care. Some of the more widely used AI techniques and applications in health care include natural language processing, which refers to the use of rule-based or ML approaches to understanding the structure and meaning of human language; rule-based expert systems; physical robots; and robotic process automation. These technologies may affect a wide range of health care stakeholders, including AI developers, researchers, health systems, payers, patients, and federal agencies.AI technologies have generally become more complex over time, progressing from rule-based expert systems to generative AI models. Within health care, the use of AI broadly falls within three categories: diagnosis and treatment, patient engagement and adherence with treatment plans, and administrative applications. While AI technologies have the potential to improve health care, they may also introduce novel challenges and exacerbate existing ones if not properly overseen. There have been a variety of federal efforts undertaken to address the use of AI in health care, including by executive orders and agency actions. Agencies within the U.S. Department of Health and Human Services (HHS) that have been active in developing relevant regulations include the Assistant Secretary for Technology Policy/Office of the National Coordinator for Health Information Technology (ASTP/ONC), the U.S. Food and Drug Administration (FDA), the Office for Civil Rights (OCR), and the Centers for Medicare & Medicaid Services (CMS). These regulatory efforts in part attempt to address challenges that may arise when AI is used in health care settings, including issues related to trust in AI technology, data access, bias, lack of transparency, privacy, scaling and integration, liability, regulatory harmonization, and environmental impact. AI is a rapidly developing and changing technology; if AI is to be used safely and effectively in health care settings, ongoing oversight and regulatory efforts may need to be addressed by Congress and relevant federal regulatory bodies. This report highlights the challenges and questions that Congress may wish to consider.",https://www.congress.gov/crs_external_products/R/PDF/R48319/R48319.3.pdf
R47997,2024-04-03T04:00:00Z,2025-06-21T03:26:11Z,Artificial Intelligence and Machine Learning in Financial Services,"The financial industry’s adoption of artificial intelligence (AI) and machine learning (ML) is evolving as financial firms employ ever greater levels of technology and automation to deliver services. Expanding on earlier models of quantitative analysis, AI/ML has often been adopted in finance to solve discrete challenges, such as maximizing profit and minimizing risk. Yet the industry’s adoption of the newer technology also occurs against perceptions that are steeped in tradition and historical financial regulation, and regulators want to ensure that the technology does not sidestep regulations frequently described as technology neutral.Technological advances in computer hardware, capacity, and data storage—which permit the collection and analysis of data—helped fuel the development and use of AI/ML technologies in finance. Unlike older algorithms that automated human-coded rules, new AI models can “learn” by themselves and make inferences and recommendations not identified by modelers in advance. This shift in technology has also enabled the use of new types of data including alternative data (i.e., data that the consumer credit bureaus do not traditionally use), unstructured data (images or social media posts, etc.), and unlabeled information data—which, when combined, extend the technologies’ uses to new financial services or products. Different parts of the financial services industry have adopted AI/ML technology to varying degrees and for various purposes. Some uses of AI/ML include powering chatbots in customer service functions, identifying investment opportunities and/or executing trades, augmenting lending models or (more sparingly) making lending decisions, and identifying and preventing fraud. The extent to which a sector or firm adopts various technologies reflects a variety of factors, including a firm’s ability to fund internal development and regulatory requirements.The increased use of AI/ML to deliver financial services has attracted attention and led to numerous policy issues and subsequent policy actions. Such policy actions culminated in (1) the establishment of a task force on AI in the 116th Congress and the more recent working group in the House Committee on Financial Services in the 118th and (2) 2019 and 2023 executive orders. The evolving legislative and regulatory framework regarding AI/ML use in finance is likely, at least in part, to influence the development of AI/ML financial services applications. Various financial regulators have indicated that regulated entities are subject to the full range of laws and regulations regardless of the technology used. Additionally, some regulators have identified regulations and issued guidance of particular relevance to financial firms employing AI/ML technologies.Financial industry policymakers face competing pressures. Financial service providers and technology companies are likely to continue adopting and promoting AI/ML to save time and money and promote accessibility, accuracy, and regulatory compliance. However, challenges and risks in the form of bias, potential for systemic risk and manipulation, affordability, and consequences for employment remain. Determining whether the existing regulatory structure is sufficient—or whether one that is more closely tailored to the technological capacities of the evolving technology is necessary—has emerged as a key consideration. Should Congress consider the legislative framework governing AI/ML in finance, industry and consumers alike will expect that it weighs the benefits of innovation with existing and potential future challenges and risks.",https://www.congress.gov/crs_external_products/R/PDF/R47997/R47997.1.pdf
