id,date,update,title,summary,pdf
IN12458,2025-02-12T05:00:00Z,2025-06-21T05:11:27Z,Artificial Intelligence: CRS Products,"Advances in artificial intelligence (AI) technologies—including machine learning, generative AI, and facial recognition technologies—are demonstrating many potential benefits across a variety of sectors of the U.S. economy. At the same time, the rapid innovation and proliferation of AI tools have generated concern over their potential disruptive effects, such as generation and dissemination of misinformation, potential shifts in jobs and employment opportunities, and social, ethical, and security risks. Previous Congresses considered a variety of policies and legislation associated with AI technologies and their applications. With interest in AI remaining high, Members of the 119th Congress may continue to engage in AI policymaking. To assist Congress, CRS has produced a range of written and audiovisual products. Below is a selection of CRS products on AI-related policy and legal issues, legislation, and executive branch actions.Selected AI CRS Products AI OverviewCRS Report R48262, Artificial Intelligence: CRS Experts and Points of Contact CRS Video WVB00685, Science and Technology Q&A: Regulating Artificial Intelligence (or, in podcast form, CRS Report WPD00096, Science and Technology Q&A: Regulating Artificial Intelligence) CRS Video WVB00650, Current Issues in Artificial Intelligence CRS Video WVB00615, Artificial Intelligence: Recent Advances and Issues for CongressCRS Report R47644, Artificial Intelligence: Overview, Recent Advances, and Considerations for the 118th Congress CRS Report WPD00050, CRS Science and Technology Podcast: Artificial Intelligence CRS Report R46795, Artificial Intelligence: Background, Selected Issues, and Policy ConsiderationsGenerative AICRS Legal Sidebar LSB11097, Section 230 Immunity and Generative Artificial IntelligenceCRS Legal Sidebar LSB10922, Generative Artificial Intelligence and Copyright LawCRS In Focus IF12426, Generative Artificial Intelligence: Overview, Issues, and Questions for CongressCRS Report R47569, Generative Artificial Intelligence and Data Privacy: A PrimerCRS Video WVB00580, Copyright Law and Generative Artificial IntelligenceCRS Video WVB00554, Science and Technology Q&A: Generative AI and Data PrivacyAI Executive Order 14110 (rescinded January 20, 2025)The following products pertain to Executive Order (E.O.) 14110, “Safe, Secure, and Trustworthy Development and Use of Artificial Intelligence,” which was rescinded on January 20, 2025, by E.O. 14148, “Initial Rescissions of Harmful Executive Orders and Actions.” The original versions of the products below also predate and do not necessarily address E.O. 14179, “Removing Barriers to American Leadership in Artificial Intelligence,” signed January 23, 2025.CRS Report R47843, Highlights of the 2023 Executive Order on Artificial Intelligence for CongressCRS Insight IN12308, The AI Executive Order and Considerations for Federal Privacy Policy CRS Insight IN12289, Law Enforcement Use of Artificial Intelligence and Directives in the 2023 Executive OrderCRS Insight IN12286, The AI Executive Order and Its Potential Implications for DODAI and DefenseSee also AI E.O. 14110 (rescinded January 20, 2025) CRS Report R47599, AUKUS Pillar 2 (Advanced Capabilities): Background and Issues for CongressCRS Report R46458, Emerging Military Technologies: Background and Issues for CongressCRS In Focus IF11105, Defense Primer: Emerging TechnologiesCRS Report R47188, Unmanned Aircraft Systems: Roles, Missions, and Future ConceptsAI and ElectionsCRS Insight IN12222, Artificial Intelligence (AI) and Campaign Finance Policy: Recent Developments CRS In Focus IF12468, Artificial Intelligence (AI) in Federal Election Campaigns: Legal Background and Constitutional Considerations for LegislationAI and FinanceCRS Video WVB00681, Artificial Intelligence in Financial ServicesCRS Report R47997, Artificial Intelligence and Machine Learning in Financial ServicesCRS In Focus IF12399, Automation, Artificial Intelligence, and Machine Learning in Consumer LendingAI and Right of PublicityCRS Video WVB00696, The Right of Publicity and Artificial Intelligence CRS Legal Sidebar LSB11052, Artificial Intelligence Prompts Renewed Consideration of a Federal Right of PublicityFacial RecognitionCRS Report R47541, Immigration: The U.S. Entry-Exit System CRS In Focus IF11333, Deep Fakes and National SecurityCRS Video WVB00328, Law Enforcement Use of Facial Recognition TechnologyCRS Report R46586, Federal Law Enforcement Use of Facial Recognition TechnologyCRS Report R46541, Facial Recognition Technology and Law Enforcement: Select Constitutional ConsiderationsAI and Other SectorsCRS Report R48319, Artificial Intelligence (AI) in Health Care CRS In Focus IF12762, The Macroeconomic Effects of Artificial Intelligence CRS Legal Sidebar LSB11251, Artificial Intelligence and Patent Law CRS In Focus IF11783, Biometric Technologies and Global SecurityCRS Video WVB00708, Disruptive Technology Series: Internet Policy in the Artificial Intelligence EraCRS Video WVB00697, Professional Ethics: Rules of Conduct and Artificial IntelligenceCRS Report R47849, Artificial Intelligence in the Biological Sciences: Uses, Safety, Security, and OversightCRS Video WVB00642, Science and Technology Q&A: Artificial Intelligence in the Biological SciencesCRS In Focus IF12497, Semiconductors and Artificial Intelligence",https://www.congress.gov/crs_external_products/IN/PDF/IN12458/IN12458.1.pdf
IN12222,2024-09-25T04:00:00Z,2025-06-21T04:28:22Z,Artificial Intelligence (AI) and Campaign Finance Policy: Recent Developments,"No federal statute or regulation specifically addresses artificial intelligence (AI) in political campaigns. The Federal Election Campaign Act (FECA) and Federal Election Commission (FEC) regulations govern conduct that calls for election or defeat of federal candidates or solicits funds. They also regulate some advertisements (electioneering communications) that refer to clearly identified federal candidates during preelection periods that do not call for election or defeat. Disclaimer requirements that mandate attribution for communications regulated by campaign finance law appear to apply to ads created with AI. Those requirements do not mandate that such advertising alert the audience, or regulators, to the presence of AI-generated content. Campaign management decisions, such as which technology to use, are generally not subject to regulation.This updated CRS Insight discusses recent developments that could be relevant as Congress monitors or considers legislation related to AI and campaign finance policy. It does not address legal issues. Other CRS products provide information on generative AI and other AI policy areas.AI in Political Campaigns, and Recent Legislative DevelopmentsRecent policy attention to AI in campaigns focuses on “deepfakes,” referring to artificially manipulated audio or video content in political advertising. Such advertising appears to present new challenges for campaigns and voters about how to determine whether communications are authentic. Recent legislation proposes disclaimers, reporting requirements, or prohibitions on deepfakes in federal campaigns or elections. Bills introduced in the 118th Congress include H.R. 3044; H.R. 3106; H.R. 3831; H.R. 4611; H.R. 5586; H.R. 8384; H.R. 8668; H.R. 9639; S. 686; S. 1596; S. 2770; and S. 3875. The Senate Committee on Rules and Administration reported an amended version of S. 3875 on May 15, 2024. The bill would amend FECA to require disclaimers on certain political advertisements that are generated using AI. Legislation (H.R. 1; H.R. 5314) addressing various elections topics, including some provisions concerning deepfakes, passed the House in the 117th Congress but was not enacted.In May 2023, the American Association of Political Consultants (AAPC) issued a statement explaining that its board of directors unanimously “condemn[ed] use of deceptive generative AI content in political campaigns” as inconsistent with the organization’s code of ethics. The AAPC position represents a voluntary professional standard, not a regulatory requirement. The AAPC also stated its support for a February 2024 Federal Communications Commission (FCC) declaratory ruling that calls made with AI-generated voices are “artificial” under the Automated Telephone Consumer Protection Act of 1991 (47 U.S.C. §227), and that using AI-generated voice for robocalls absent prior consumer consent is “illegal.” FCC activity on robocalls is otherwise beyond the scope of this Insight. Despite the focus on AI’s role in political advertising, AI also can serve campaign-management functions. For example, political professionals or volunteers could use AI to automate, or supplement human labor to complete, various internal campaign tasks. According to media reports, campaigns have used AI to perform data analysis, compile opposition research, or draft fundraising appeals.Federal Election Commission Rulemaking ActivityOn June 22, 2023, members of the FEC deadlocked on whether to issue a notice of availability (NOA) to receive comments on an AI rulemaking petition from the interest group Public Citizen. The request asked the FEC to issue rules specifying that the FEC fraudulent misrepresentation of campaign authority prohibition (52 U.S.C. §30124) applied to AI-generated ads. At the June 22 meeting, some commissioners expressed skepticism about the agency’s statutory authority to regulate AI ads; others expressed support for a rulemaking. On July 13, 2023, several Members of Congress wrote to the commission expressing “disappoint[ment]” with the FEC’s action and requested additional information. The commission considered a second Public Citizen rulemaking petition on August 10, 2023. In this case, it approved an NOA. Discussion at the August 10 meeting suggested that at least some commissioners continued to have reservations about the commission’s authority concerning regulating AI ads in particular; about the appropriateness of the FECA fraudulent misrepresentation provision as an avenue to do so; or both. Fifty-two Members of Congress submitted joint comments encouraging the FEC to adopt rules specifying that the fraudulent-misrepresentation provisions apply to ads created using generative AI, and to require disclaimers on ads created with the technology. The matter remained under consideration for the next year.On September 19, 2024, the commission took two actions. It approved a notice of disposition (NOD) to resolve the July 2023 Public Citizen petition without issuing new rules. The NOD notes that the fraudulent-misrepresentation provision is “technology neutral and applies on its face to all means” of fraudulent misrepresentation, “including AI-assisted media.”It approved an interpretive rule, based on existing regulation and statute, confirming that the FECA fraudulent misrepresentation provision also covers communications generated using AI. To summarize, the commission did not issue new rules concerning AI. It clarified that the existing fraudulent misrepresentation provisions in FECA and FEC regulations (11 C.F.R. §110.16(a)) apply to communications generated using AI. Those actions do not affect AI or campaign finance beyond the fraudulent misrepresentation provision, nor do they require additional disclaimers on political advertising. Discussion at the open meeting suggests that a majority of the commission believes that it currently lacks legislative authority to issue broader rules concerning AI.FEC Responses to Federal Communications Commission ActivitySome House and Senate activity has examined a proposed FCC rulemaking that does not directly implicate campaign finance policy and which is largely beyond the scope of this Insight. On July 25, 2024, the FCC approved a notice of proposed rulemaking (NPRM), published in the Federal Register on August 5. If approved, the rules would require certain licensees (e.g., broadcasters) to (1) announce on air that a political ad contains “AI-generated content”; and (2) include the information in their “political files” of advertising contracts. Another CRS product discusses identification requirements on political advertising in telecommunications law and regulation. On June 3, 2024, FEC Chair Sean Cooksey wrote to FCC Chair Jessica Rosenworcel, stating that the reportedly forthcoming FCC proposed rules would infringe on FEC jurisdiction and could cause confusion before the general election. Three days later, FEC Vice Chair Ellen Weintraub wrote to Rosenworcel stating that the FCC could add telecommunications expertise to AI regulation. It is unclear how or whether the FEC might respond if the FCC adopted the proposed rules.Potential Policy Considerations for CongressIf pursuing legislation, Congress might need to determine whether to do so narrowly, such as by addressing specific AI issues, or to also address other campaign finance or elections topics. Congress has pursued both approaches to campaign finance regulation recently. If Congress chose to task the FEC with pursuing rulemaking without also providing additional statutory guidance, it is possible that the commission would be unable to agree, with the four of six minimum required votes, about how to proceed. Maintaining the status quo likely would reinforce the emerging debate about whether additional regulation is needed, including about what role industry should play. Congress could also require agency (or committee or task force) study of AI issues before, or in addition to, other policymaking. Amending FECA would be a typical approach to further regulate ads that are made by political committees; or that solicit funds, engage in express advocacy, or refer to federal candidates through electioneering communications. Although Congress could also amend FECA or another statute to require disclaimers on ads that do not meet those requirements (e.g., issue advocacy), federal campaign finance law currently generally does not regulate issue advocacy. As noted above, amending telecommunications law or regulation could affect broadcasters or other entities that transmit ads, and could affect issue advocacy in ways that campaign finance law and regulation do not. Prohibiting AI-generated ads or requiring additional disclaimers might raise First Amendment concerns, such as those discussed in another CRS campaign finance product.",https://www.congress.gov/crs_external_products/IN/PDF/IN12222/IN12222.5.pdf
IG10077,2025-04-25T04:00:00Z,2025-06-21T06:38:06Z,Artificial Intelligence (AI) Taxonomy,"/Information as of April 25, 2025. Prepared by Laurie Harris, Analyst in Science and Technology Policy; Nora Wells, Analyst in Health Policy; and Juan Pablo Madrid, Visual Information Specialist. Experts generally describe AI as the broad concept of machine-based systems that can do tasks commonly thought to require human intelligence, like making predictions and recommendations, translating languages, or generating text, images, audio, and video. The term has evolved as research and applications of AI technologies have advanced, leading to the development of new terminology. As Congress works to develop and enact legislation related to AI technologies, questions frequently arise around what terms to define, how to define them, and how they are interrelated. This infographic describes key AI terms and illustrates how they are related to one another. (Note that while this represents a synthesis of ideas from many AI experts and stakeholders, the definitions and intersections of these terms are evolving and still under debate. There are not universally agreed-upon bright lines or hierarchies among terms.) There has been some debate over whether expert systems should still be considered AI, as they cannot adapt to unexpected inputs or variables outside of what they were trained on (i.e., they lack a learning component).Artificial Intelligence (AI) is a broad term referring to algorithms and techniques that aim to give computer systems the ability to learn new concepts or tasks and solve complex problems in a manner that mimics human intelligence. The concept of AI and AI systems can encompass a range of technologies, methodologies, and application areas, such as natural language processing, facial recognition, and robotics.Expert Systems, an early approach to making machines that mimic human intelligence, are algorithms encoded with expert knowledge but lacking a learning component. In these rules-based systems, programmers solve a problem, then program routines and rules that the system uses to respond to new inputs.Robotics refers to the design, construction, and use of machines (robots) to replicate, or assist with, human actions. Robotics is one area where AI can be applied in physical applications, sometimes called robotic learning, to help robots learn and improve their performance through self-exploration or guidance from human operators.Machine Learning (ML), often referred to as a subfield of AI, uses algorithms to enable systems to identify and learn from patterns or relationships in data without being explicitly programmed. The performance of these systems can improve as they learn from more data to then make predictions or decisions on new, unseen data.Deep Learning (DL), a subset of ML, uses neural network (NN) techniques to process and analyze large-scale, complex data, including text, image, and audio. NNs were originally inspired by how layers of neurons in the human brain signal each other, with the artificial neurons grouped into layers of interconnected nodes (i.e., computational units). NNs “learn” by adjusting the connections between nodes, tuning the system based on characteristics of the training data to correspond to the correct output; this is the general process of AI model training. A DL system usually has numerous layers that can consist of thousands or millions of processing nodes. Given the size and complexity of most NNs built for AI model training, the terms DL and NN are often used interchangeably.Natural Language Processing (NLP) refers to the use of rules-based or ML approaches to understand the structure and meaning of written or spoken human language. DL, GenAI, and LLMs have been leveraged for NLP applications such as improving language translation and powering chatbots, thus spanning multiple AI terms and approaches.Generative AI (GenAI) refers to AI systems that can generate content—such as written material, audio, images, or computer code—from prompts using advanced techniques such as NNs that help the underlying models better understand how data elements influence and depend on one another. General-Purpose AI Models, often referred to as foundation models (FMs), are GenAI models trained on large amounts of diverse types of data that can be fine-tuned for a wide range of downstream tasks. Large language models (LLMs) are one category of FMs designed to learn from and generate text for applications such as language translation, question answering, and  computer code generation.",https://www.congress.gov/crs_external_products/IG/PDF/IG10077/IG10077.1.pdf
R48555,2025-06-04T04:00:00Z,2025-08-01T11:38:01Z,Regulating Artificial Intelligence: U.S. and International Approaches and Considerations for Congress,"Artificial intelligence (AI) presents many potential benefits and challenges in the private and public sectors. No federal legislation establishing broad regulatory authorities for the development or use of AI or prohibitions on AI has been enacted. Recent Congresses have passed primarily more targeted AI provisions. Different Administrations have focused their attention on federal engagement in AI, albeit with somewhat different emphases on specific topics. The focus on AI safety under the Biden Administration appears to be shifting toward security concerns during the second Trump Administration. Stakeholders in the United States have debated how to approach AI innovation and regulation in order to harness the opportunities of AI technologies, such as enhanced government operations and worker efficiency, while minimizing potential problems, such as bias and inaccuracies in AI-generated output. U.S. AI Governance and RegulationOutside of broad AI governance frameworks, most of the U.S. regulatory efforts regarding AI have centered on (1) federal agency assessments and enforcement of existing regulatory authorities, (2) exploration of whether individual agencies require additional authorities, and (3) securing voluntary commitments from industry. Much of the legislation proposed in the 118th and 119th Congresses have emphasized the development of voluntary guidelines and best practices and reporting of industry-conducted evaluations of AI systems. The approach of the U.S. federal government as a whole appears to be cautious in regard to regulating AI in the private sector and more focused on oversight of federal government uses of AI. In the absence of federal AI regulations, states have been enacting their own laws. Critics assert that such a patchwork of AI laws creates challenges for companies and that a nationwide regulatory structure may incentivize product development. Approaches to AI Governance and Regulation, Including International ApproachesProponents of broad federal AI regulations assert that they would lead to less legal uncertainty for AI developers and improve the public’s trust in AI systems, thus supporting AI innovation. Opponents of broad federal AI regulations assert that industry is taking steps to self-regulate and that additional regulation would stifle innovation at a time when international competition in AI is accelerating, which could lead to negative economic and national security outcomes for the United States. Other analysts have criticized such characterizations as presenting a false dichotomy between regulation and innovation and instead support a mixture of targeted, flexible approaches depending on the AI technology and its application. Similar to the United States, some other countries, including the United Kingdom, have taken to date a measured approach to regulating AI. In contrast, the European Union (EU) has enacted a broad regulatory approach through the EU AI Act, which classifies AI systems into risk categories with different degrees of requirements and obligations. Some analysts have raised concerns that the EU AI Act creates or will create barriers for companies developing and deploying AI. China has enacted targeted AI laws and is working on broader AI regulation, though China’s economic and science and technology policies feature a heavy government role in private sector development. China’s approach has been characterized as a vertical, technology-specific framework influenced by national security concerns and economic development goals, with the EU’s AI Act described as a horizontal, risk-based framework focused on ethical considerations and transparency.Considerations and Options for CongressCongress and the Administration might frame AI legislation and policies in various ways. One approach could include actions aimed at promoting AI safety and averting risks to people, another approach may focus more on security, and yet another approach may focus on accelerating innovation potentially accompanied by voluntary commitments from industry. These approaches, among others, may also be combined. Congressional actions might focus on leveraging federal agencies’ existing authorities without enacting additional AI-specific laws or on creating new cross-sector authorities or broad regulations to address potential risks from AI, such as transparency and accountability requirements. Additionally, congressional actions might focus on providing federal agencies with authorities or direction to support domestic AI development—such as through public-private partnerships and providing resources for AI research and education—or engaging with international efforts to harmonize AI governance. In a time of rapid AI development, such efforts may need to frequently evolve or incorporate mechanisms for periodic review and flexibility at the state and federal levels.",https://www.congress.gov/crs_external_products/R/PDF/R48555/R48555.4.pdf
