Number,Type,Congress,Title,Url,Sponsor,Subject,Text Access
2617,HR,117,"Consolidated Appropriations Act, 2023",https://api.congress.gov/v3/bill/117/hr/2617?format=xml,"Rep. Connolly, Gerald E. [D-VA-11]",Economics and Public Finance,https://www.congress.gov/117/bills/hr2617/BILLS-117hr2617enr.xml
6833,HR,117,"Continuing Appropriations and Ukraine Supplemental Appropriations Act, 2023",https://api.congress.gov/v3/bill/117/hr/6833?format=xml,"Rep. Craig, Angie [D-MN-2]",Economics and Public Finance,https://www.congress.gov/117/bills/hr6833/BILLS-117hr6833enr.xml
1437,HR,117,"Further Continuing Appropriations and Extensions Act, 2023",https://api.congress.gov/v3/bill/117/hr/1437?format=xml,"Rep. Sherrill, Mikie [D-NJ-11]",Economics and Public Finance,https://www.congress.gov/117/bills/hr1437/BILLS-117hr1437enr.xml
5376,HR,117,Inflation Reduction Act of 2022,https://api.congress.gov/v3/bill/117/hr/5376?format=xml,"Rep. Yarmuth, John A. [D-KY-3]",Economics and Public Finance,https://www.congress.gov/117/bills/hr5376/BILLS-117hr5376enr.xml
1319,HR,117,American Rescue Plan Act of 2021,https://api.congress.gov/v3/bill/117/hr/1319?format=xml,"Rep. Yarmuth, John A. [D-KY-3]",Economics and Public Finance,https://www.congress.gov/117/bills/hr1319/BILLS-117hr1319enr.xml
5305,HR,117,Extending Government Funding and Delivering Emergency Assistance Act,https://api.congress.gov/v3/bill/117/hr/5305?format=xml,"Rep. DeLauro, Rosa L. [D-CT-3]",Economics and Public Finance,https://www.congress.gov/117/bills/hr5305/BILLS-117hr5305enr.xml
75,HJRES,117,"Extension of Continuing Appropriations Act, 2022",https://api.congress.gov/v3/bill/117/hjres/75?format=xml,"Rep. DeLauro, Rosa L. [D-CT-3]",Economics and Public Finance,https://www.congress.gov/117/bills/hjres75/BILLS-117hjres75enr.xml
6617,HR,117,Further Additional Extending Government Funding Act,https://api.congress.gov/v3/bill/117/hr/6617?format=xml,"Rep. DeLauro, Rosa L. [D-CT-3]",Economics and Public Finance,https://www.congress.gov/117/bills/hr6617/BILLS-117hr6617enr.xml
6119,HR,117,Further Extending Government Funding Act,https://api.congress.gov/v3/bill/117/hr/6119?format=xml,"Rep. DeLauro, Rosa L. [D-CT-3]",Economics and Public Finance,https://www.congress.gov/117/bills/hr6119/BILLS-117hr6119enr.xml
2471,HR,117,"Consolidated Appropriations Act, 2022",https://api.congress.gov/v3/bill/117/hr/2471?format=xml,"Rep. Jeffries, Hakeem S. [D-NY-8]",Economics and Public Finance,https://www.congress.gov/117/bills/hr2471/BILLS-117hr2471enr.xml
1301,S,117,Promoting Physical Activity for Americans Act,https://api.congress.gov/v3/bill/117/s/1301?format=xml,"Sen. Brown, Sherrod [D-OH]",Economics and Public Finance,https://www.congress.gov/117/bills/s1301/BILLS-117s1301enr.xml
33,SJRES,117,A joint resolution relating to increasing the debt limit.,https://api.congress.gov/v3/bill/117/sjres/33?format=xml,"Sen. Schumer, Charles E. [D-NY]",Economics and Public Finance,https://www.congress.gov/117/bills/sjres33/BILLS-117sjres33enr.xml
272,S,117,Congressional Budget Justification Transparency Act of 2021,https://api.congress.gov/v3/bill/117/s/272?format=xml,"Sen. Peters, Gary C. [D-MI]",Economics and Public Finance,https://www.congress.gov/117/bills/s272/BILLS-117s272enr.xml
10545,HR,118,"American Relief Act, 2025",https://api.congress.gov/v3/bill/118/hr/10545?format=xml,"Rep. Cole, Tom [R-OK-4]",Economics and Public Finance,https://www.congress.gov/118/bills/hr10545/BILLS-118hr10545enr.xml
7032,HR,118,Congressional Budget Office Data Sharing Act,https://api.congress.gov/v3/bill/118/hr/7032?format=xml,"Rep. Boyle, Brendan F. [D-PA-2]",Economics and Public Finance,https://www.congress.gov/118/bills/hr7032/BILLS-118hr7032enr.xml
1549,S,118,Congressional Budget Office Data Access Act,https://api.congress.gov/v3/bill/118/s/1549?format=xml,"Sen. Peters, Gary C. [D-MI]",Economics and Public Finance,https://www.congress.gov/118/bills/s1549/BILLS-118s1549enr.xml
9747,HR,118,"Continuing Appropriations and Extensions Act, 2025",https://api.congress.gov/v3/bill/118/hr/9747?format=xml,"Rep. Cole, Tom [R-OK-4]",Economics and Public Finance,https://www.congress.gov/118/bills/hr9747/BILLS-118hr9747enr.xml
815,HR,118,"Making emergency supplemental appropriations for the fiscal year ending September 30, 2024, and for other purposes.",https://api.congress.gov/v3/bill/118/hr/815?format=xml,"Rep. McMorris Rodgers, Cathy [R-WA-5]",Economics and Public Finance,https://www.congress.gov/118/bills/hr815/BILLS-118hr815enr.xml
2882,HR,118,"Further Consolidated Appropriations Act, 2024",https://api.congress.gov/v3/bill/118/hr/2882?format=xml,"Rep. Ciscomani, Juan [R-AZ-6]",Economics and Public Finance,https://www.congress.gov/118/bills/hr2882/BILLS-118hr2882enr.xml
4366,HR,118,"Consolidated Appropriations Act, 2024",https://api.congress.gov/v3/bill/118/hr/4366?format=xml,"Rep. Carter, John R. [R-TX-31]",Economics and Public Finance,https://www.congress.gov/118/bills/hr4366/BILLS-118hr4366enr.xml
7463,HR,118,"Extension of Continuing Appropriations and Other Matters Act, 2024",https://api.congress.gov/v3/bill/118/hr/7463?format=xml,"Rep. Granger, Kay [R-TX-12]",Economics and Public Finance,https://www.congress.gov/118/bills/hr7463/BILLS-118hr7463enr.xml
6363,HR,118,"Further Continuing Appropriations and Other Extensions Act, 2024",https://api.congress.gov/v3/bill/118/hr/6363?format=xml,"Rep. Granger, Kay [R-TX-12]",Economics and Public Finance,https://www.congress.gov/118/bills/hr6363/BILLS-118hr6363enr.xml
5860,HR,118,"Continuing Appropriations Act, 2024 and Other Extensions Act",https://api.congress.gov/v3/bill/118/hr/5860?format=xml,"Rep. Granger, Kay [R-TX-12]",Economics and Public Finance,https://www.congress.gov/118/bills/hr5860/BILLS-118hr5860enr.xml
3746,HR,118,Fiscal Responsibility Act of 2023,https://api.congress.gov/v3/bill/118/hr/3746?format=xml,"Rep. McHenry, Patrick T. [R-NC-10]",Economics and Public Finance,https://www.congress.gov/118/bills/hr3746/BILLS-118hr3746enr.xml
